{
  "$schema": "http://json-schema.org/draft-07/schema#",
  "title": "Profitability Dataset Quality Report v1",
  "description": "Machine-readable dataset quality report for CDB Profitability Engine candidate validation. This report evaluates dataset readiness for research and evidence only; it does not authorize backtest validity by itself, paper promotion, runtime changes, or live-readiness progress.",
  "type": "object",
  "additionalProperties": false,
  "required": [
    "schema_version",
    "report_id",
    "dataset_id",
    "dataset_fingerprint",
    "generated_at",
    "symbol",
    "timeframe",
    "requested_window",
    "observed_window",
    "coverage_summary",
    "checks",
    "quality_verdict",
    "blocking_reasons",
    "limitations"
  ],
  "properties": {
    "schema_version": {
      "const": "profitability_dataset_quality_report.v1"
    },
    "report_id": {
      "type": "string",
      "pattern": "^dq-[a-z0-9][a-z0-9-]{2,80}$"
    },
    "dataset_id": {
      "type": "string",
      "minLength": 1,
      "maxLength": 160
    },
    "dataset_fingerprint": {
      "type": "string",
      "pattern": "^sha256:[a-f0-9]{64}$"
    },
    "generated_at": {
      "type": "string",
      "format": "date-time"
    },
    "symbol": {
      "type": "string",
      "pattern": "^[A-Z0-9_:-]{3,40}$"
    },
    "timeframe": {
      "type": "string",
      "minLength": 1,
      "maxLength": 20
    },
    "requested_window": {
      "type": "object",
      "additionalProperties": false,
      "required": [
        "start_ts_ms",
        "end_ts_ms"
      ],
      "properties": {
        "start_ts_ms": {
          "type": "integer",
          "minimum": 0
        },
        "end_ts_ms": {
          "type": "integer",
          "minimum": 0
        }
      }
    },
    "observed_window": {
      "type": "object",
      "additionalProperties": false,
      "required": [
        "start_ts_ms",
        "end_ts_ms",
        "candles_expected",
        "candles_observed"
      ],
      "properties": {
        "start_ts_ms": {
          "type": "integer",
          "minimum": 0
        },
        "end_ts_ms": {
          "type": "integer",
          "minimum": 0
        },
        "candles_expected": {
          "type": "integer",
          "minimum": 0
        },
        "candles_observed": {
          "type": "integer",
          "minimum": 0
        }
      }
    },
    "coverage_summary": {
      "type": "object",
      "additionalProperties": false,
      "required": [
        "coverage_ratio",
        "missing_candle_count",
        "duplicate_timestamp_count",
        "out_of_order_count",
        "timeframe_mismatch_count"
      ],
      "properties": {
        "coverage_ratio": {
          "type": "number",
          "minimum": 0.0,
          "maximum": 1.0
        },
        "missing_candle_count": {
          "type": "integer",
          "minimum": 0
        },
        "duplicate_timestamp_count": {
          "type": "integer",
          "minimum": 0
        },
        "out_of_order_count": {
          "type": "integer",
          "minimum": 0
        },
        "timeframe_mismatch_count": {
          "type": "integer",
          "minimum": 0
        }
      }
    },
    "checks": {
      "type": "object",
      "additionalProperties": false,
      "required": [
        "coverage_check",
        "missing_candle_check",
        "duplicate_check",
        "ordering_check",
        "timeframe_consistency_check",
        "symbol_window_metadata_check",
        "dataset_fingerprint_check"
      ],
      "properties": {
        "coverage_check": {
          "$ref": "#/definitions/checkResult"
        },
        "missing_candle_check": {
          "$ref": "#/definitions/checkResult"
        },
        "duplicate_check": {
          "$ref": "#/definitions/checkResult"
        },
        "ordering_check": {
          "$ref": "#/definitions/checkResult"
        },
        "timeframe_consistency_check": {
          "$ref": "#/definitions/checkResult"
        },
        "symbol_window_metadata_check": {
          "$ref": "#/definitions/checkResult"
        },
        "dataset_fingerprint_check": {
          "$ref": "#/definitions/checkResult"
        }
      }
    },
    "quality_verdict": {
      "type": "string",
      "enum": [
        "PASS",
        "WARNING",
        "FAIL",
        "BLOCKED"
      ]
    },
    "blocking_reasons": {
      "type": "array",
      "items": {
        "type": "string",
        "minLength": 1,
        "maxLength": 500
      }
    },
    "limitations": {
      "type": "array",
      "items": {
        "type": "string",
        "minLength": 1,
        "maxLength": 500
      }
    }
  },
  "definitions": {
    "checkResult": {
      "type": "object",
      "additionalProperties": false,
      "required": [
        "status",
        "summary"
      ],
      "properties": {
        "status": {
          "type": "string",
          "enum": [
            "PASS",
            "WARNING",
            "FAIL",
            "BLOCKED"
          ]
        },
        "summary": {
          "type": "string",
          "minLength": 1,
          "maxLength": 1000
        },
        "details": {
          "type": "array",
          "items": {
            "type": "string",
            "minLength": 1,
            "maxLength": 500
          }
        }
      }
    }
  }
}
